{
  "schema_version": "GG-INSTRUCTIONAL-CONTENT-1.0",
  "competency_id": "04.02",
  "title": "Let finite time change one ordinary priority",
  "scored": false,
  "sections": [
    {
      "id": "purpose-and-method",
      "kind": "concept",
      "title": "Understand the distinction",
      "body": "Awareness of finitude can clarify a modest present choice without creating a countdown or urgency to control others. A priority changes through performed conduct, not through the intensity of its intention."
    },
    {
      "id": "supplied-case",
      "kind": "material",
      "title": "Complete fictional practice material",
      "body": "Jo owns a worn favorite book and has 30 discretionary minutes tonight. Reading and writing a private memory note need 20; optional browsing could use all 30. The book can be handled ordinarily and needs no repair in this case. A friend has not agreed to a call, and no urgent reconciliation is required."
    },
    {
      "id": "case-attempt",
      "kind": "prompt",
      "title": "Work through the supplied case",
      "body": "Choose an available action and its opportunity cost, then identify what a later record would need to show. Keep another person’s availability separate.",
      "references": [
        "supplied-case"
      ],
      "check_id": "case-check",
      "attempt_mode": "practice"
    },
    {
      "id": "changed-case",
      "kind": "prompt",
      "title": "Try a different case before checking",
      "body": "A person promises to reconnect someday after thinking about mortality, but takes no step. May the review describe a repaired relationship?",
      "check_id": "changed-case-check",
      "attempt_mode": "unaided"
    }
  ],
  "checks": [
    {
      "id": "case-check",
      "title": "Compare reasoning and review the supplied result",
      "body": "Reading and a private note can fit 20 minutes with 10 spare, displacing browsing. Later fiction: Jo writes the note but does not read; only the note occurred. Partial: record the full intended 20 as done. Incorrect: demand an immediate friend call because time is finite. A smaller fulfilled choice may matter without proving transformed priorities.",
      "criteria": [
        "Finitude informs a feasible present choice",
        "Others’ consent is preserved",
        "Intention and changed conduct are distinguished"
      ]
    },
    {
      "id": "changed-case-check",
      "title": "Check the changed case",
      "body": "No. It records reflection and an intention only. A welcome bounded invitation might be a later action, with response and repair still separate.",
      "criteria": [
        "Finitude informs a feasible present choice",
        "Others’ consent is preserved",
        "Intention and changed conduct are distinguished"
      ]
    }
  ]
}
