{
  "schema_version": "GG-INSTRUCTIONAL-CONTENT-1.0",
  "competency_id": "13.09",
  "title": "Read a maintenance need and brief a technician",
  "scored": false,
  "sections": [
    {
      "id": "purpose-and-method",
      "kind": "concept",
      "title": "Understand the distinction",
      "body": "A maintenance record distinguishes due work, completed service, unknown history and user-level observation. A manual excerpt for one model does not apply automatically to another."
    },
    {
      "id": "supplied-case",
      "kind": "material",
      "title": "Complete fictional practice material",
      "body": "Entire fictional device manual excerpt: Model R wheeled storage cart; inspect handle and wheel attachment visually before use, without dismantling; stop use if a wheel is visibly loose; authorized technician checks attachment yearly. This is a constructed training card, not instructions for an actual product. Service record: technician check April 10 last year; today May 1 this year; no later entry. Observation: left wheel appears angled, looseness not confirmed. No running machinery is involved."
    },
    {
      "id": "case-attempt",
      "kind": "prompt",
      "title": "Work through the supplied case",
      "body": "Prepare a factual technician brief with model, record date, observation and unknowns. Distinguish the permitted visual check from an unapproved repair.",
      "references": [
        "supplied-case"
      ],
      "check_id": "case-check",
      "attempt_mode": "practice"
    },
    {
      "id": "changed-case",
      "kind": "prompt",
      "title": "Try a different case before checking",
      "body": "A bicycle’s manual cannot be matched to its exact model, and the owner guesses tire pressure from another bicycle. What should the brief preserve?",
      "check_id": "changed-case-check",
      "attempt_mode": "unaided"
    }
  ],
  "checks": [
    {
      "id": "case-check",
      "title": "Compare reasoning and review the supplied result",
      "body": "The annual recorded check is more than a year old; later service is unknown, not certainly absent. Report the angled wheel without diagnosing the fastener. Follow the actual product’s stop/use guidance and seek appropriate inspection before assuming suitability. Partial: report date but omit model. Incorrect: invent torque or claim a photograph certifies safety. No real service was performed.",
      "criteria": [
        "Model and record provenance are explicit",
        "Observation is separated from diagnosis",
        "Unknown specifications do not become repair instructions"
      ]
    },
    {
      "id": "changed-case-check",
      "title": "Check the changed case",
      "body": "Keep the specification unknown and obtain the actual manufacturer/model guidance or competent service help. A nearby model’s value is not established for this equipment.",
      "criteria": [
        "Model and record provenance are explicit",
        "Observation is separated from diagnosis",
        "Unknown specifications do not become repair instructions"
      ]
    }
  ]
}
