{
  "schema_version": "GG-INSTRUCTIONAL-CONTENT-1.0",
  "competency_id": "05.02",
  "title": "Retell a life chapter with agency and circumstance",
  "scored": false,
  "sections": [
    {
      "id": "purpose-and-method",
      "kind": "concept",
      "title": "Understand the distinction",
      "body": "A life narrative selects events and meaning. A fair revision adds agency, constraint and received help without turning every loss into growth or every contribution into solitary heroism."
    },
    {
      "id": "supplied-case",
      "kind": "material",
      "title": "Complete fictional practice material",
      "body": "Complete fictional chapter: before joining a drawing group, Rae practiced alone using a borrowed pencil and free library pages. At the turning point a friend offered two specific shading corrections; Rae practiced them for three evenings. Now Rae can shade one simple form but still finds proportion difficult. One exhibition invitation was missed because transport was unavailable. No award or further feedback exists."
    },
    {
      "id": "case-attempt",
      "kind": "prompt",
      "title": "Work through the supplied case",
      "body": "Write before/turning-point/now, separating events from interpretation. Correct “I mastered drawing alone” without erasing Rae’s effort or the missed opportunity.",
      "references": [
        "supplied-case"
      ],
      "check_id": "case-check",
      "attempt_mode": "practice"
    },
    {
      "id": "changed-case",
      "kind": "prompt",
      "title": "Try a different case before checking",
      "body": "A narrative accurately names a structural barrier but omits the person’s actual preparation and request for help. What can be added without blaming them for the barrier?",
      "check_id": "changed-case-check",
      "attempt_mode": "unaided"
    }
  ],
  "checks": [
    {
      "id": "case-check",
      "title": "Compare reasoning and review the supplied result",
      "body": "A fair account credits practice, borrowed materials and feedback, limits the skill to one form and retains the transport loss. Partial: add help but still claim mastery. Incorrect: recast the missed exhibition as necessary for growth without evidence. Later fiction: Rae accepts an accessible text demonstration and makes one improved form; long-term development remains unknown.",
      "criteria": [
        "Events and interpretation are distinguishable",
        "Agency and received support coexist",
        "Remaining difficulty or loss is retained"
      ]
    },
    {
      "id": "changed-case-check",
      "title": "Check the changed case",
      "body": "Add those actions as agency within the constraint. They neither caused nor removed every external condition; a richer narrative need not choose between total hero and total victim.",
      "criteria": [
        "Events and interpretation are distinguishable",
        "Agency and received support coexist",
        "Remaining difficulty or loss is retained"
      ]
    }
  ]
}
