{
  "schema_version": "GG-INSTRUCTIONAL-CONTENT-1.0",
  "competency_id": "01.10",
  "title": "Rebuild one commitment after disappointment",
  "scored": false,
  "sections": [
    {
      "id": "purpose-and-method",
      "kind": "concept",
      "title": "Understand the distinction",
      "body": "Disillusionment can challenge a particular promise without invalidating every good. Reconstruction may change an institutional affiliation, a role or a belief; none requires forced gratitude or immediate replacement certainty."
    },
    {
      "id": "supplied-case",
      "kind": "material",
      "title": "Complete fictional practice material",
      "body": "Fictional Sol expected a certificate to produce belonging. After receiving it, no group contact followed. Sol still enjoys drawing small landscapes, has an already welcome Thursday meal with a friend and owes no further course fee. Sol questions the marketing promise, not whether every kind of learning has value. No traumatic event or acute crisis is supplied."
    },
    {
      "id": "case-attempt",
      "kind": "prompt",
      "title": "Work through the supplied case",
      "body": "Separate failed expectation, supported facts and global interpretations. Choose one remaining good and a low-demand action, without claiming the disappointment was beneficial.",
      "references": [
        "supplied-case"
      ],
      "check_id": "case-check",
      "attempt_mode": "practice"
    },
    {
      "id": "changed-case",
      "kind": "prompt",
      "title": "Try a different case before checking",
      "body": "A group breaks one explicit promise. Someone concludes every possible community is unsafe. What can be challenged without denying the breach?",
      "check_id": "changed-case-check",
      "attempt_mode": "unaided"
    }
  ],
  "checks": [
    {
      "id": "case-check",
      "title": "Compare reasoning and review the supplied result",
      "body": "A meal or private drawing can retain its own value. Later fiction: Sol attends the meal and remains disappointed; companionship occurred, not a cure. Partial: name a remaining good without a feasible action. Incorrect: infer all relationships or learning are fraudulent. For an institution, examine specific governance/complaint evidence before affiliation decisions; for faith, compare authorized interpretations with a willing trusted adviser if desired; for role identity, try a reversible expression of the valued good. These are distinct inquiries, not compelled conversions.",
      "criteria": [
        "The failed promise is stated specifically",
        "A remaining good is not used to erase loss",
        "Next steps fit the kind of disillusionment"
      ]
    },
    {
      "id": "changed-case-check",
      "title": "Check the changed case",
      "body": "The universal inference exceeds the supplied breach. Preserve the specific harm, appropriate boundaries and need for support while leaving other groups unknown. Joining a replacement group is optional, not proof of recovery.",
      "criteria": [
        "The failed promise is stated specifically",
        "A remaining good is not used to erase loss",
        "Next steps fit the kind of disillusionment"
      ]
    }
  ]
}
