{
  "schema_version": "GG-INSTRUCTIONAL-CONTENT-1.0",
  "competency_id": "03.09",
  "title": "Use a small ritual to connect remembrance with action",
  "scored": false,
  "sections": [
    {
      "id": "purpose-and-method",
      "kind": "concept",
      "title": "Understand the distinction",
      "body": "A ritual can organize attention through a repeated symbolic form. Its meaning, actual enactment and any promised later action are separate. A missed action does not prove the participant’s inner sincerity was false, but it remains missed."
    },
    {
      "id": "supplied-case",
      "kind": "material",
      "title": "Complete fictional practice material",
      "body": "Original fictional closing ritual: Jo places an owned smooth stone on the desk, names a friend’s welcome help, acknowledges an overdue borrowed card, chooses to return it Thursday 16:00 and begins 10 minutes of rest. The friend is not present; no sacred tradition is claimed. The desk accepts returns at that time."
    },
    {
      "id": "case-attempt",
      "kind": "prompt",
      "title": "Work through the supplied case",
      "body": "Identify each element’s function and what would count as performed ritual versus completed repair. Choose an accessible private version without requiring disclosure.",
      "references": [
        "supplied-case"
      ],
      "check_id": "case-check",
      "attempt_mode": "practice"
    },
    {
      "id": "changed-case",
      "kind": "prompt",
      "title": "Try a different case before checking",
      "body": "A participant uses silent written recollection and declines sharing a loss. Does that make the ritual invalid?",
      "check_id": "changed-case-check",
      "attempt_mode": "unaided"
    }
  ],
  "checks": [
    {
      "id": "case-check",
      "title": "Compare reasoning and review the supplied result",
      "body": "Object, acknowledgment, unresolved matter, next action and rest have distinct roles. Later fiction: the ritual and rest occur, but Thursday’s return is missed. Preserve both; revise the return arrangement without calling the ritual a completed repair or diagnosing empty faith. Partial: report only the meaningful feeling. Incorrect: say speaking the intention returned the card.",
      "criteria": [
        "Symbolic act and later conduct differ",
        "Privacy and optional participation remain real",
        "A missed action is retained without judging inner worth"
      ]
    },
    {
      "id": "changed-case-check",
      "title": "Check the changed case",
      "body": "No. An agreed accessible/private form can preserve remembrance and intention. Do not require grief disclosure or an emotional display as proof of meaning.",
      "criteria": [
        "Symbolic act and later conduct differ",
        "Privacy and optional participation remain real",
        "A missed action is retained without judging inner worth"
      ]
    }
  ]
}
