{
  "schema_version": "GG-INSTRUCTIONAL-CONTENT-1.0",
  "competency_id": "06.09",
  "title": "Remove one concrete barrier from a piece of everyday information",
  "scored": false,
  "sections": [
    {
      "id": "purpose-and-method",
      "kind": "concept",
      "title": "Understand the distinction",
      "body": "Accessible information makes required facts available through a workable mode; a clear-looking artifact can still have a bad reading order or an unconfirmed physical route."
    },
    {
      "id": "supplied-case",
      "kind": "material",
      "title": "Complete fictional practice material",
      "body": "Fresh notice facts: map discussion Friday 11:00–11:30, Room D; materials supplied; questions accepted by text through the organizer or in person. Step-free room access is not confirmed. Flawed draft image reads “Friday, usual room, bring supplies”; its text alternative says only “event poster.” The author controls both versions."
    },
    {
      "id": "case-attempt",
      "kind": "prompt",
      "title": "Work through the supplied case",
      "body": "Write a complete ordinary-text notice and useful text alternative. Name the unverified access fact and a short reading-order check rather than claiming universal compliance.",
      "references": [
        "supplied-case"
      ],
      "check_id": "case-check",
      "attempt_mode": "practice"
    },
    {
      "id": "changed-case",
      "kind": "prompt",
      "title": "Try a different case before checking",
      "body": "A notice puts a cancellation only in red text with no words identifying its status. What should change?",
      "check_id": "changed-case-check",
      "attempt_mode": "unaided"
    }
  ],
  "checks": [
    {
      "id": "case-check",
      "title": "Compare reasoning and review the supplied result",
      "body": "Preserve Friday 11:00–11:30, Room D, supplied materials, both question routes and unconfirmed step-free access. The alternative needs the essential content, not “poster.” Later fiction: a reader receives place before time but can identify all facts; this is one usable result, not universal accessibility. Partial: fix text but leave an empty alternative. Incorrect: advertise step-free access without confirmation.",
      "criteria": [
        "All required facts survive the format change",
        "Meaning is not carried by color or image alone",
        "Unverified physical access stays explicit"
      ]
    },
    {
      "id": "changed-case-check",
      "title": "Check the changed case",
      "body": "Express cancellation in words with the affected event/date and any verified next step; color may supplement but cannot be the sole carrier of the essential distinction.",
      "criteria": [
        "All required facts survive the format change",
        "Meaning is not carried by color or image alone",
        "Unverified physical access stays explicit"
      ]
    }
  ]
}
